{
  "schema_version": 1,
  "slug": "schietwetter-umbrella-keychain",
  "classification": "HYBRID",
  "status": "READY_FOR_REVIEW",
  "critical_questions_open": false,
  "concept_required": true,
  "current_version": "v001",
  "requirements_approval": {
    "user_text": "Да, сделай так, чтобы получилось красиво... я согласен отказаться от мелких деталей.",
    "recorded_at": "2026-09-28T20:01:00+00:00"
  },
  "concept_approval": {
    "user_text": "Да, крутой концепт... я согласен отказаться от мелких деталей.",
    "recorded_at": "2026-09-28T20:01:00+00:00"
  },
  "history": [
    {
      "from": "INTAKE",
      "to": "WAITING_FOR_INPUT",
      "evidence": "Initial keychain brief captured; blocking choices remained.",
      "recorded_at": "2026-09-28T19:55:00+00:00"
    },
    {
      "from": "WAITING_FOR_INPUT",
      "to": "READY_TO_MODEL",
      "evidence": "User approved 45 mm size, top loop, tourist style, multi-color body structure and simplification of fine details.",
      "recorded_at": "2026-09-28T20:01:00+00:00"
    },
    {
      "from": "READY_TO_MODEL",
      "to": "GEOMETRY_DRAFT",
      "evidence": "Requirements and concept approved; start v001 canonical geometry.",
      "recorded_at": "2026-09-28T20:05:00+00:00"
    },
    {
      "from": "GEOMETRY_DRAFT",
      "to": "READY_FOR_REVIEW",
      "evidence": "v001 candidate 3MF reopened independently; geometric QA completed with no BLOCKER; candidate ID 62091427; technical proof views rendered only from reopened candidate geometry.",
      "recorded_at": "2026-09-28T20:30:00+00:00"
    }
  ]
}
